{
  "schema_version": "capture-manifest-v1",
  "capture_id": "fsb-0025-after-c79f0ec",
  "capture_kind": "legacy_text",
  "raw_artifacts": [
    "build.log",
    "legacy-occurrences.jsonl"
  ],
  "command": "dotnet build tools/Circus.Tooling/Circus.Tooling.fsproj -c Release",
  "working_directory": null,
  "repository_commit_oid": "c79f0ecfff6b7e4c34ae469ea55a4a4b60adca91",
  "repository_tree_oid": "2cf1c11e8e6f3c9c950affa87706361c9601755b",
  "working_tree_state": "detached",
  "source_root_aliases": [
    {
      "absolute_root": "/tmp/after-c79f0ec",
      "canonical_root": "/home/thecircus/Projects/thecircus"
    }
  ],
  "dotnet_sdk_version": "10.0.202",
  "msbuild_version": null,
  "fsharp_compiler_version": null,
  "operating_system": "Linux",
  "architecture": "x86_64",
  "culture": "en-US",
  "started_at": null,
  "completed_at": null,
  "exit_code": 0,
  "metadata_gaps": [
    "msbuild_version",
    "fsharp_compiler_version",
    "started_at",
    "completed_at"
  ]
}